### ISSUE TITLE
`Received Response Length` Always Zero

### ISSUE THREAD

**Issue by TheDr1ver** [stanford-esrg/lzr#13]
I've been attempting to get LZR to play nicely with ZMap and I'm finding I keep running into an issue where I apparently am getting no data response from anything I'm attempting to scan.

I've tried both in an externally-facing environment and on my internal network as well, but no matter what I do I can't seem to get a received response length above 0.

I've tested on both the latest version of Ubuntu 23 as well as Ubuntu 22 LTS and I'm getting the same results.

Example chain of commands:

```bash

LOCAL_SRC_IP=192.168.1.100 # (eth0 ipv4 address - LZR compiled with this same value for internal scans. Separately, I compiled LZR with my external/ISP-provided IP for external scans when running from a VPS.)

GATEWAY=<my eth0 gateway mac>

sudo zmap 192.168.1.0/24 --target-port=80 -O json -f "saddr,daddr,sport,dport,seqnum,acknum,window,ttl" \
--source-ip=$LOCAL_SRC_IP --output-filter="success=1 && repeat=0" | \
sudo ~/lzr/lzr -d --handshakes "http,tls" -sendInterface eth0 -gatewayMac $GATEWAY -feedZGrab
```

ZMap appears to successfully identify all the hosts that are running HTTP services on `:80` in the above example, but LZR consistently returns `TotalResponses: 0`.

Example output:

```
Oct 19 XX [INFO] dedup: Response deduplication method is window with size 1000000
++Writing results to file: default_20231019XX.json
++Handshakes: http,tls
++Using Sending Interface: eth0
++Using Gateway Mac: redacted
++Feeding ZGrab with fingerprints
++Worker threads: 1
++Timeout Interval (s): 5
++Retransmit Interval (s): 1
++Number of Retransmitions: 1
Oct 19 XX [INFO] recv: duplicate responses will be passed to the output module
Oct 19 XX [INFO] recv: unsuccessful responses will be passed to the output module
 0:00 1%; send: 134 1 p/s (2.04 Kp/s avg); recv: 0 0 p/s (0 p/s avg); drops: 0 p/s (0 p/s avg); hitrate: 0.00%

<...snip...>

192.168.1.222 ====
recv seq num: 2905414489
stored seqnum:  2905414489
recv ack num: 1494555975
stored acknum:  1494555975
received response length:  0
stored response length:  111
192.168.1.222 ====
 0:08 100% (1s left); send: 256 done (6.83 Kp/s avg); recv: 145 0 p/s (18 p/s avg); drops: 0 p/s (0 p/s avg); hitrate: 56.64%
Oct 19 XX [INFO] zmap: completed
Finished Reading Input
Runtime: 9.047087634s
{"TotalResponses":0,"ZeroWindow":0,"ACKed":0,"Data":0,"No_SYNACK":0,"Rst":0,"Fin":0,"Resp_ack":0,"HyperACKtive":0}
```

Any ideas on how to get LZR properly reading the scan data and identifying the proper protocols would be greatly appreciated - thanks in advance!

**Comment by LizIzhikevich** [comment]
Just to make sure I am understanding things correctly: have you confirmed that 1. lzr is in fact _sending_ packets 2. those packets have the expected src/dest/port?
You can confirm by, for example, running a tcpdump e while running zmap/lzr.

**Comment by TheDr1ver** [comment]
Good question... I'm not entirely sure how to interpret this result as to whether it's picking up zmap or lzr sending the packets.

Command:
```
 sudo zmap 192.168.1.0/24 -p 22,80,443,5001 -B 200m --probe-ttl=510 --sender-threads 5 --seed=1234 -O json -f "saddr,daddr,sport,dport,seqnum,acknum,window" --source-ip=$local_src --output-filter="success=1 && repeat=0" | tee zmap_out.json | sudo ~/lzr/lzr -d --handshakes http,tls -sendInterface ens33 -gatewayMac $gateway -feedZGrab | tee lzr_out.csv
```

Result:
```
192.168.1.1 ====
recv seq num: 3356739880
stored seqnum:  3356739880
recv ack num: 522467909
stored acknum:  522467909
received response length:  0
stored response length:  108
192.168.1.1 ====
```

Grep tcpdump:
```
cat test | grep 522467909
20:59:29.459035 00:e0:67:14:b9:d3 (oui Unknown) > 00:0c:29:7c:e9:2f (oui Unknown), ethertype IPv4 (0x0800), length 60: pfSense.localdomain.http > myti-scanner.52122: Flags [S.], seq 3356739880, ack 522467909, win 65228, options [mss 1460], length 0
20:59:30.460440 00:e0:67:14:b9:d3 (oui Unknown) > 00:0c:29:7c:e9:2f (oui Unknown), ethertype IPv4 (0x0800), length 60: pfSense.localdomain.http > myti-scanner.52122: Flags [S.], seq 3356739880, ack 522467909, win 65228, options [mss 1460], length 0
20:59:32.658513 00:e0:67:14:b9:d3 (oui Unknown) > 00:0c:29:7c:e9:2f (oui Unknown), ethertype IPv4 (0x0800), length 60: pfSense.localdomain.http > myti-scanner.52122: Flags [S.], seq 3356739880, ack 522467909, win 65228, options [mss 1460], length 0
20:59:36.858421 00:e0:67:14:b9:d3 (oui Unknown) > 00:0c:29:7c:e9:2f (oui Unknown), ethertype IPv4 (0x0800), length 60: pfSense.localdomain.http > myti-scanner.52122: Flags [S.], seq 3356739880, ack 522467909, win 65228, options [mss 1460], length 0
20:59:37.171959 00:0c:29:7c:e9:2f (oui Unknown) > 00:0c:29:7c:e9:2f (oui Unknown), ethertype IPv4 (0x0800), length 60: myti-scanner.52122 > pfSense.localdomain.http: Flags [R], seq 522467909, win 0, length 0
20:59:37.172049 00:0c:29:7c:e9:2f (oui Unknown) > 00:0c:29:7c:e9:2f (oui Unknown), ethertype IPv4 (0x0800), length 60: myti-scanner.52123 > pfSense.localdomain.http: Flags [S], seq 522467909, win 65228, length 0
```

It looks like maybe zmap is sending a RST from `52122`  after getting replies from .1 before (I assume) LZR sends a SYN from `52123`? If I'm interpreting that correctly?

**Comment by TheDr1ver** [comment]
Apologies as I was in a rush when writing the last example. Maybe this example from the same scan will be more helpful?

```
192.168.1.11 ====
recv seq num: 3770074450
stored seqnum:  3770074450
recv ack num: 2844830951
stored acknum:  2844830951
received response length:  0
stored response length:  109
192.168.1.11 ====



20:59:29.428711 <MAC01> (oui Unknown) > <MAC02> (oui Unknown), ethertype IPv4 (0x0800), length 58: myti-scanner.34224 > 192.168.1.11.https: Flags [S], seq 3537657093, win 65535, options [mss 1460], length 0
20:59:29.431645 <MAC01> (oui Unknown) > <MAC02> (oui Unknown), ethertype IPv4 (0x0800), length 58: myti-scanner.39026 > 192.168.1.11.http: Flags [S], seq 845467868, win 65535, options [mss 1460], length 0
20:59:29.439809 <MAC01> (oui Unknown) > <MAC02> (oui Unknown), ethertype IPv4 (0x0800), length 58: myti-scanner.52323 > 192.168.1.11.5001: Flags [S], seq 1510766753, win 65535, options [mss 1460], length 0
20:59:29.439878 <MAC01> (oui Unknown) > <MAC02> (oui Unknown), ethertype IPv4 (0x0800), length 58: myti-scanner.38316 > 192.168.1.11.ssh: Flags [S], seq 2844830950, win 65535, options [mss 1460], length 0
20:59:29.470603 <MAC03> (oui Unknown) > <MAC01> (oui Unknown), ethertype IPv4 (0x0800), length 60: 192.168.1.11.ssh > myti-scanner.38316: Flags [S.], seq 3770074450, ack 2844830951, win 14600, options [mss 1460], length 0
20:59:29.475399 <MAC03> (oui Unknown) > <MAC01> (oui Unknown), ethertype IPv4 (0x0800), length 60: 192.168.1.11.5001 > myti-scanner.52323: Flags [R.], seq 0, ack 1510766754, win 0, length 0
20:59:30.857454 <MAC03> (oui Unknown) > <MAC01> (oui Unknown), ethertype IPv4 (0x0800), length 60: 192.168.1.11.ssh > myti-scanner.38316: Flags [S.], seq 3770074450, ack 2844830951, win 14600, options [mss 1460], length 0
20:59:31.169299 <MAC01> (oui Unknown) > <MAC01> (oui Unknown), ethertype IPv4 (0x0800), length 163: myti-scanner.38316 > 192.168.1.11.ssh: Flags [.], seq 1:110, ack 1, win 14600, length 109
20:59:32.170580 <MAC01> (oui Unknown) > <MAC01> (oui Unknown), ethertype IPv4 (0x0800), length 163: myti-scanner.38316 > 192.168.1.11.ssh: Flags [P.], seq 1:110, ack 1, win 14600, length 109
20:59:32.857466 <MAC03> (oui Unknown) > <MAC01> (oui Unknown), ethertype IPv4 (0x0800), length 60: 192.168.1.11.ssh > myti-scanner.38316: Flags [S.], seq 3770074450, ack 2844830951, win 14600, options [mss 1460], length 0
20:59:36.857777 <MAC03> (oui Unknown) > <MAC01> (oui Unknown), ethertype IPv4 (0x0800), length 60: 192.168.1.11.ssh > myti-scanner.38316: Flags [S.], seq 3770074450, ack 2844830951, win 14600, options [mss 1460], length 0
20:59:37.172320 <MAC01> (oui Unknown) > <MAC01> (oui Unknown), ethertype IPv4 (0x0800), length 60: myti-scanner.38316 > 192.168.1.11.ssh: Flags [R], seq 2844830951, win 0, length 0
20:59:37.172418 <MAC01> (oui Unknown) > <MAC01> (oui Unknown), ethertype IPv4 (0x0800), length 60: myti-scanner.38317 > 192.168.1.11.ssh: Flags [S], seq 2844830951, win 14600, length 0
```

**Comment by TheDr1ver** [comment]
Wow. Sometimes you just need to step back for a little bit to think of something new to try. 

It turns out the problem was probably two-fold. 

First, I was using the `gatewayMac` wrong... which is obvious after leaving my desk for 3 hrs haha. For that, I just removed the parameter entirely and let LZR do the gateway detection for me.

Secondly, I really knew next to nothing about setting up a proper GO environment before today, so that was probably causing issues as well. The fact that `go get` throws a deprecation error in favor of `go install` was further confusing things.

For anyone else who finds themselves in the same spot, try this to install LZR:

```bash
cd ~
mkdir src
mkdir bin
GOPATH=/home/username/go
GOBIN=/home/username/go/bin
go env -w GOPATH=/home/username/go
go env -w GOBIN=/home/username/go/bin
cd ~/go/src
mkdir github.com && cd ./github.com
mkdir stanford-esrg && cd ./stanford-esrg
git clone https://github.com/stanford-esrg/lzr
cd ./lzr
go get github.com/stanford-esrg/lzr
SRC_IP=$(curl <URL that returns your external IP address>)
make all source-ip=$SRC_IP
cd ~
mkdir lzr_results && cd lzr_results
```

Then to run it (assuming ZMap already installed):
```bash
sudo zmap <target-network-range> -p 80,443 -O json -f "saddr,daddr,sport,dport,seqnum,acknum,window" \
--source-ip=$SRC_IP --output-filter="success=1 && repeat=0" | \
tee zmap_out.json | \
sudo $GOPATH/src/github.com/stanford-esrg/lzr/lzr -d --handshakes http,tls \
-sendInterface <your-primary-network-interface> -feedZGrab \
| tee zgrab_input.txt
```

Thanks very much for getting back to me so quickly before @LizIzhikevich - I had a feeling it was something silly on my end :)

**Comment by TheDr1ver** [comment]
eh... I thought I had it figured out, but there must be something else going on because I ran the same exact command that worked the first time directly from my bash history... and now I'm back to getting 0 responses again.

I assume this isn't a common problem? :)

**Comment by TheDr1ver** [comment]
So when I switched to a new port/handshake everything worked great with this command... Then a minute later I literally just hit 'up/enter' to run the same exact command and I was back to getting `received response length: 0` across the board.

```
sudo zmap <target> -p 22 -B 200m --probe-ttl=510 --sender-threads 5 --seed=1234 -O json -f "saddr,daddr,sport,dport,seqnum,acknum,window,ttl" --source-ip=$SRC_IP --output-filter="success=1 && repeat=0" | tee zmap_out_22.json | sudo $GOPATH/src/github.com/stanford-esrg/lzr/lzr -d --handshakes ssh,tls -sendInterface <interface> -feedZGrab | tee lzr_zgrab_feed_22.txt
```

Does LZR leave something open maybe that won't allow it to run the same command successfully twice?

...or is it more likely that everything I hit on the first pass is simply blocking me on the second attempt?

**Comment by TheDr1ver** [comment]
After messing with different configurations and installations all day, I'm kins of at a loss at this point.

In all environments I tested, scanning internal and external, it seems I can run the exact same command ~10x in a row, and 9 times it will fail with the error in the title, then 1 time it will work without issue.

**Comment by LizIzhikevich** [comment]
So it looks like according to the second tcp dump you provide, lzr is sending the expected "Push Ack" with data, but for some reason the target service is responding with a "SYN ACK" to the PUSH. Its almost as if some firewall or something is either dropping LZR's Push ACKs. or the service is somehow not seeing LZR's push ACKs. So its 50% possible that this is a lzr bug i.e., something about the connection state is corrupted and LZR is sending a push ack with a wrong sequence number or something such that the target service does not register it. But its also 50% possible that theres something going on outside of LZR's control, where there is a firewall or some kind of dynamic behavior that is blocking LZR's PUSH (if the lzr push seem to be formatted correctly). 

Given your other comments, it appears that the first time you run it, the target service likely sees the Push Ack and responds. but then something happens and it no longer sees LZR's push acks? 

Just to confirm, do you run the ip tables rule that outputs when you make lzr? (the one that makes zmap stop RSTing connections)

Also is the source ip you scan from somehow overlapping with the IP addresses you choose to scan? If so, I wonder if that is somehow related to the problem?

**Comment by TheDr1ver** [comment]
Thanks for the suggestions -

To clarify, I've confirmed the IP tables rule is the only one added that isn't an otherwise standard rule, so there shouldn't be any issues there.

The issue appears to be happen when I run scans from a VPS that has its own dedicated, external IP, scanning a different external subnet than what it's on.

It also happens when I'm scanning a handful of specific internal IPs when I launch the scan from an internal box against IPs on the same subnet (but not scanning itself).

Unfortunately, it doesn't appear to always work with the first attempt. Earlier today I ran a scan that failed in the way described 9x in a row before finally getting a successful fun, and I didn't change anything between runs, so I'm quite confused as to what might be the culprit.

**Comment by LizIzhikevich** [comment]
Thanks for the clarifications. 

Yea so according to the tcp dump that you screenshotted, lzr has expected behavior. it is sending the push ack with the correct sequence/ack number, and the service you are talking to just keeps sending SYN-ACKs (i.e., the it never sees the PUSH ACK). So I am not sure how else to help to debug the fact that the other service on your network only once-in-a-while chooses to see LZR's Push/ACK.  is `myti-scanner` always the same IP address? i.e., its not that lzr is using some sort of ip that is different than what zmap used?

**Comment by TheDr1ver** [comment]
`myti-scanner` has the same static IP that LZR was compiled with, unfortunately. The part that I find the most strange is that the VPS node seems to be exhibiting the same behavior.

I can try installing on a fresh box/OS install at some point either this weekend or next week. I'm wondering if it has something to do with the way Ubuntu 22/23 is natively handling networking.

Is there a particular distribution you know this current version of LZR is working with?

Thanks again for all your help.

**Comment by LizIzhikevich** [comment]
So I am told the problem here likely lies with VPS. We use lzr ourselves on ubuntu22, but in a non-VPS environment. You might take a look at VPS issues in the zmap repo, and see if they help debug.

**Comment by TheDr1ver** [comment]
I'm having the internal issues on a dedicated Ubuntu 22 LTS VMWare Workstation instance running off a Win10 host, so it's entirely possible the virtualization is screwing it up.

The VPS issues are the same, but they're on a completely external entity and a dedicated box, so that would be surprising to me.

In either case I find it strange that it would sometimes work perfectly and sometimes not.

If you're able to discuss more specific details, please hit me up sometime next week via email or keybase (@thedr1ver)

**Comment by TheDr1ver** [comment]
So, after revisiting this for a little while, I think I've at least found a hint suggesting where the problem might lie. 

In this scenario I ran the exact same command to scan ports 80 and 443 with http,tcp handshakes set. 

The first time I ran it, the scans failed in the way I was describing previously. However, the second time I ran the exact same command it worked as intended.

# Failed Example
```
16:57:51.278933 <eth0-mac-addy> (oui Unknown) > fe:00:00:00:01:01 (oui Unknown), ethertype IPv4 (0x0800), length 58: my-scanning-host.60373 > scan-target.https: Flags [S], seq 1633688749, win 65535, options [mss 1460], length 0
16:57:51.279021 <eth0-mac-addy> (oui Unknown) > fe:00:00:00:01:01 (oui Unknown), ethertype IPv4 (0x0800), length 58: my-scanning-host.57269 > scan-target.http: Flags [S], seq 2834121915, win 65535, options [mss 1460], length 0
16:57:51.339544 fe:00:00:00:01:01 (oui Unknown) > <eth0-mac-addy> (oui Unknown), ethertype IPv4 (0x0800), length 58: scan-target.http > my-scanning-host.57269: Flags [S.], seq 2320546301, ack 2834121916, win 64240, options [mss 1460], length 0
16:57:52.846321 fe:00:00:00:01:01 (oui Unknown) > <eth0-mac-addy> (oui Unknown), ethertype IPv4 (0x0800), length 126: 67.207.67.3.domain > my-scanning-host.49891: 39625 1/0/1 PTR scan-target. (84)
16:57:52.846345 fe:00:00:00:01:01 (oui Unknown) > <eth0-mac-addy> (oui Unknown), ethertype IPv4 (0x0800), length 141: 67.207.67.3.domain > my-scanning-host.36832: Flags [P.], seq 6444:6519, ack 2971, win 128, options [nop,nop,TS val 2725611973 ecr 2089789842], length 75 35271 1/0/0 PTR scan-target. (73)
16:57:53.707397 <eth0-mac-addy> (oui Unknown) > <eth0-mac-addy> (oui Unknown), ethertype IPv4 (0x0800), length 164: my-scanning-host.57269 > scan-target.http: Flags [.], seq 1:111, ack 1, win 64240, length 110: HTTP: GET / HTTP/1.1
16:57:54.351505 fe:00:00:00:01:01 (oui Unknown) > <eth0-mac-addy> (oui Unknown), ethertype IPv4 (0x0800), length 58: scan-target.http > my-scanning-host.57269: Flags [S.], seq 2320546301, ack 2834121916, win 64240, options [mss 1460], length 0
16:57:54.708058 <eth0-mac-addy> (oui Unknown) > <eth0-mac-addy> (oui Unknown), ethertype IPv4 (0x0800), length 164: my-scanning-host.57269 > scan-target.http: Flags [P.], seq 1:111, ack 1, win 64240, length 110: HTTP: GET / HTTP/1.1
16:58:12.352020 fe:00:00:00:01:01 (oui Unknown) > <eth0-mac-addy> (oui Unknown), ethertype IPv4 (0x0800), length 56: scan-target.http > my-scanning-host.57269: Flags [R], seq 2320546302, win 0, length 0
16:58:17.273042 <eth0-mac-addy> (oui Unknown) > fe:00:00:00:01:01 (oui Unknown), ethertype IPv4 (0x0800), length 58: my-scanning-host.41288 > scan-target.https: Flags [S], seq 992530560, win 65535, options [mss 1460], length 0
16:58:17.273229 <eth0-mac-addy> (oui Unknown) > fe:00:00:00:01:01 (oui Unknown), ethertype IPv4 (0x0800), length 58: my-scanning-host.49060 > scan-target.http: Flags [S], seq 680496146, win 65535, options [mss 1460], length 0
16:58:17.332396 fe:00:00:00:01:01 (oui Unknown) > <eth0-mac-addy> (oui Unknown), ethertype IPv4 (0x0800), length 58: scan-target.http > my-scanning-host.49060: Flags [S.], seq 2253554870, ack 680496147, win 64240, options [mss 1460], length 0
16:58:19.581380 <eth0-mac-addy> (oui Unknown) > <eth0-mac-addy> (oui Unknown), ethertype IPv4 (0x0800), length 164: my-scanning-host.49060 > scan-target.http: Flags [.], seq 1:111, ack 1, win 64240, length 110: HTTP: GET / HTTP/1.1
16:58:20.335472 fe:00:00:00:01:01 (oui Unknown) > <eth0-mac-addy> (oui Unknown), ethertype IPv4 (0x0800), length 58: scan-target.http > my-scanning-host.49060: Flags [S.], seq 2253554870, ack 680496147, win 64240, options [mss 1460], length 0
16:58:20.582064 <eth0-mac-addy> (oui Unknown) > <eth0-mac-addy> (oui Unknown), ethertype IPv4 (0x0800), length 164: my-scanning-host.49060 > scan-target.http: Flags [P.], seq 1:111, ack 1, win 64240, length 110: HTTP: GET / HTTP/1.1
16:58:25.583286 <eth0-mac-addy> (oui Unknown) > <eth0-mac-addy> (oui Unknown), ethertype IPv4 (0x0800), length 60: my-scanning-host.49060 > scan-target.http: Flags [R], seq 680496147, win 0, length 0
16:58:25.583291 <eth0-mac-addy> (oui Unknown) > <eth0-mac-addy> (oui Unknown), ethertype IPv4 (0x0800), length 60: my-scanning-host.49061 > scan-target.http: Flags [S], seq 680496147, win 64240, length 0
16:58:26.338119 fe:00:00:00:01:01 (oui Unknown) > <eth0-mac-addy> (oui Unknown), ethertype IPv4 (0x0800), length 58: scan-target.http > my-scanning-host.49060: Flags [S.], seq 2253554870, ack 680496147, win 64240, options [mss 1460], length 0
```

# Successful Example
```
17:11:34.305896 <eth0-mac-addy> (oui Unknown) > fe:00:00:00:01:01 (oui Unknown), ethertype IPv4 (0x0800), length 58: my-scanning-host.36256 > scan-target.https: Flags [S], seq 2300440525, win 65535, options [mss 1460], length 0
17:11:34.306059 <eth0-mac-addy> (oui Unknown) > fe:00:00:00:01:01 (oui Unknown), ethertype IPv4 (0x0800), length 58: my-scanning-host.34508 > scan-target.http: Flags [S], seq 125792875, win 65535, options [mss 1460], length 0
17:11:34.365800 fe:00:00:00:01:01 (oui Unknown) > <eth0-mac-addy> (oui Unknown), ethertype IPv4 (0x0800), length 58: scan-target.http > my-scanning-host.34508: Flags [S.], seq 221324049, ack 125792876, win 64240, options [mss 1460], length 0
17:11:36.704758 <eth0-mac-addy> (oui Unknown) > fe:00:00:00:01:01 (oui Unknown), ethertype IPv4 (0x0800), length 164: my-scanning-host.34508 > scan-target.http: Flags [.], seq 1:111, ack 1, win 64240, length 110: HTTP: GET / HTTP/1.1
17:11:36.781022 fe:00:00:00:01:01 (oui Unknown) > <eth0-mac-addy> (oui Unknown), ethertype IPv4 (0x0800), length 7354: scan-target.http > my-scanning-host.34508: Flags [.], seq 1:7301, ack 111, win 64130, length 7300: HTTP: HTTP/1.1 200 OK
17:11:36.781022 fe:00:00:00:01:01 (oui Unknown) > <eth0-mac-addy> (oui Unknown), ethertype IPv4 (0x0800), length 7354: scan-target.http > my-scanning-host.34508: Flags [.], seq 7301:14601, ack 111, win 64130, length 7300: HTTP
17:11:36.799448 <eth0-mac-addy> (oui Unknown) > fe:00:00:00:01:01 (oui Unknown), ethertype IPv4 (0x0800), length 60: my-scanning-host.34508 > scan-target.http: Flags [R], seq 125792986, win 0, length 0
17:11:36.813792 <eth0-mac-addy> (oui Unknown) > fe:00:00:00:01:01 (oui Unknown), ethertype IPv4 (0x0800), length 74: my-scanning-host.53244 > scan-target.http: Flags [S], seq 1675839893, win 64240, options [mss 1460,sackOK,TS val 842674241 ecr 0,nop,wscale 7], length 0
17:11:36.872101 fe:00:00:00:01:01 (oui Unknown) > <eth0-mac-addy> (oui Unknown), ethertype IPv4 (0x0800), length 66: scan-target.http > my-scanning-host.53244: Flags [S.], seq 1654038688, ack 1675839894, win 65535, options [mss 1460,nop,wscale 8,nop,nop,sackOK], length 0
17:11:36.872115 <eth0-mac-addy> (oui Unknown) > fe:00:00:00:01:01 (oui Unknown), ethertype IPv4 (0x0800), length 54: my-scanning-host.53244 > scan-target.http: Flags [.], ack 1, win 502, length 0
17:11:36.887217 <eth0-mac-addy> (oui Unknown) > fe:00:00:00:01:01 (oui Unknown), ethertype IPv4 (0x0800), length 164: my-scanning-host.53244 > scan-target.http: Flags [P.], seq 1:111, ack 1, win 502, length 110: HTTP: GET / HTTP/1.1
17:11:36.948331 fe:00:00:00:01:01 (oui Unknown) > <eth0-mac-addy> (oui Unknown), ethertype IPv4 (0x0800), length 14654: scan-target.http > my-scanning-host.53244: Flags [.], seq 1:14601, ack 111, win 1026, length 14600: HTTP: HTTP/1.1 200 OK
17:11:36.948352 <eth0-mac-addy> (oui Unknown) > fe:00:00:00:01:01 (oui Unknown), ethertype IPv4 (0x0800), length 54: my-scanning-host.53244 > scan-target.http: Flags [.], ack 14601, win 447, length 0
17:11:37.008244 fe:00:00:00:01:01 (oui Unknown) > <eth0-mac-addy> (oui Unknown), ethertype IPv4 (0x0800), length 20258: scan-target.http > my-scanning-host.53244: Flags [P.], seq 14601:34805, ack 111, win 1026, length 20204: HTTP
17:11:37.008318 <eth0-mac-addy> (oui Unknown) > fe:00:00:00:01:01 (oui Unknown), ethertype IPv4 (0x0800), length 54: my-scanning-host.53244 > scan-target.http: Flags [.], ack 34805, win 361, length 0
17:11:37.042684 <eth0-mac-addy> (oui Unknown) > fe:00:00:00:01:01 (oui Unknown), ethertype IPv4 (0x0800), length 54: my-scanning-host.53244 > scan-target.http: Flags [F.], seq 111, ack 34805, win 501, length 0
17:11:37.100719 fe:00:00:00:01:01 (oui Unknown) > <eth0-mac-addy> (oui Unknown), ethertype IPv4 (0x0800), length 56: scan-target.http > my-scanning-host.53244: Flags [.], ack 112, win 1026, length 0
17:11:37.100719 fe:00:00:00:01:01 (oui Unknown) > <eth0-mac-addy> (oui Unknown), ethertype IPv4 (0x0800), length 56: scan-target.http > my-scanning-host.53244: Flags [F.], seq 34805, ack 112, win 1026, length 0
17:11:37.100736 <eth0-mac-addy> (oui Unknown) > fe:00:00:00:01:01 (oui Unknown), ethertype IPv4 (0x0800), length 54: my-scanning-host.53244 > scan-target.http: Flags [.], ack 34806, win 501, length 0
```

As you can see above, it appears in the failed example the GET request was sent TO and FROM the same MAC address, rather than to the `fe:00:00:00:01:01` address as expected. I suspect whatever is causing LZR to behave in this way is also preventing the GET request from ever reaching the external target... which is why we never get a 200 OK response.

Does this make sense? Again, the exact same command was run in both scenarios, but for whatever reason the GET request in the first scenario appears to have been sent from eth0 to eth0, never reaching the external host.

**Comment by TheDr1ver** [comment]
Wow, that... appears to be what the problem was. As long as I run LZR with the dummy MAC set using `-gatewayMac "fe:00:00:00:01:01"` it (so far) appears to be running without issue!
